{"$schema":"https://json-schema.org/draft/2020-12/schema","$id":"https://ndoracle.org/schema/types/resource-v0.2.json","title":"ND Oracle resource object v0.2","type":"object","additionalProperties":false,"required":["schema_version","id","type","status","provenance","name","category","description","intended_use","audience_or_context","related_objects","claims","experience_ids","limitations","cost_or_access_notes","conflicts_of_interest"],"properties":{"schema_version":{"const":"0.2"},"id":{"$ref":"https://ndoracle.org/schema/common-v0.2.json#/$defs/identifier"},"type":{"const":"resource"},"status":{"$ref":"https://ndoracle.org/schema/common-v0.2.json#/$defs/status"},"provenance":{"$ref":"https://ndoracle.org/schema/common-v0.2.json#/$defs/provenance"},"name":{"$ref":"https://ndoracle.org/schema/common-v0.2.json#/$defs/nonBlankString"},"category":{"enum":["tool","app","game","book","media","service","accommodation","organisation","community","practical_guide","product","education_work_resource","other"]},"description":{"$ref":"https://ndoracle.org/schema/common-v0.2.json#/$defs/nonBlankString"},"intended_use":{"$ref":"https://ndoracle.org/schema/common-v0.2.json#/$defs/nonBlankString"},"audience_or_context":{"$ref":"https://ndoracle.org/schema/common-v0.2.json#/$defs/nonBlankString"},"related_objects":{"type":"array","items":{"$ref":"https://ndoracle.org/schema/common-v0.2.json#/$defs/typedReference"}},"claims":{"type":"array","items":{"$ref":"https://ndoracle.org/schema/common-v0.2.json#/$defs/claim"}},"experience_ids":{"type":"array","items":{"$ref":"https://ndoracle.org/schema/common-v0.2.json#/$defs/identifier"},"uniqueItems":true},"limitations":{"type":"array","items":{"$ref":"https://ndoracle.org/schema/common-v0.2.json#/$defs/nonBlankString"}},"cost_or_access_notes":{"type":"array","items":{"$ref":"https://ndoracle.org/schema/common-v0.2.json#/$defs/nonBlankString"}},"conflicts_of_interest":{"type":"array","items":{"$ref":"https://ndoracle.org/schema/common-v0.2.json#/$defs/nonBlankString"}}}}