{"schema_version":"0.2","id":"fixture-resource","type":"resource","name":"Fixture resource","status":"draft","category":"tool","description":"A synthetic resource used only for schema and validator tests.","intended_use":"Exercise resource validation without implying efficacy.","audience_or_context":"Automated tests only.","related_objects":[{"type":"concept","id":"fixture-concept"}],"claims":[{"id":"fixture-resource-claim","text":"The synthetic resource is available inside the fixture graph.","confidence":"moderate","evidence_ids":["fixture-evidence"],"uncertainties":[{"id":"fixture-resource-uncertainty","text":"Availability is only meaningful inside the synthetic test graph.","why_it_matters":"This limitation constrains interpretation.","reopening_or_reduction_conditions":["Additional synthetic evidence would reduce it."],"status":"open"}],"question_ids":["fixture-question"]}],"experience_ids":["fixture-experience-a","fixture-experience-b"],"limitations":["Not a real resource."],"cost_or_access_notes":["No real cost or access claim."],"conflicts_of_interest":[],"provenance":{"created":"2026-08-11","created_by":"test fixture","method":"Synthetic test-only fixture","review_state":"unreviewed_seed","last_reviewed":null}}